{
  "id": "PSPHD-00005",
  "status": "OBSERVED",
  "target": "PSP emulator configuration documentation",
  "subsystem": "configuration",
  "title_or_game": "UNKNOWN",
  "emulator_version": "UNKNOWN",
  "finding": "The local core packet lists package-ps4.conf, config-title.txt, config-region.txt, and config-emu-ps4.txt as package/configuration filenames. It does not specify their contents, roles, title associations, values, defaults, or effects; those details are UNKNOWN.",
  "evidence_references": [
    "Local packet: research/sources/psphd_ps4devwiki_core.md; existing source attribution S1 (source URL: https://www.psdevwiki.com/ps4/index.php?title=PSP_Emulation&oldid=297238)"
  ],
  "confidence": "MEDIUM",
  "related_findings": ["PSPHD-00002", "PSPHD-00004", "PSPHD-00006"],
  "tests": [],
  "notes": ["The packet only supplies filenames. Do not infer file roles, contents, precedence, or title/version applicability. The packet itself contains no URL."]
}
