{
  "id": "PSPHD-00004",
  "status": "OBSERVED",
  "target": "PSP Emulation package-layout documentation",
  "subsystem": "package structure",
  "title_or_game": "UNKNOWN",
  "emulator_version": "UNKNOWN",
  "finding": "The local core packet lists assets/, assets/PSPHD, app/USER_L0.IMG, sce_module, sce_sys, usermodule, vms, trophy_data, eboot.bin, revision.conf, package-ps4.conf, config-title.txt, config-region.txt, and config-emu-ps4.txt. Component purposes and load order are UNKNOWN.",
  "evidence_references": [
    "Local packet: research/sources/psphd_ps4devwiki_core.md; existing source attribution S1 (source URL: https://www.psdevwiki.com/ps4/index.php?title=PSP_Emulation&oldid=297238)"
  ],
  "confidence": "MEDIUM",
  "related_findings": ["PSPHD-00005", "PSPHD-00012"],
  "tests": [],
  "notes": ["Only the names shown in the packet are retained. The packet does not identify USER_L0.IMG's purpose or establish a complete package layout; it contains no URL."]
}
