{
  "id": "PSPHD-00009",
  "status": "OBSERVED",
  "target": "Official PSP emulator patch examples",
  "subsystem": "graphics",
  "title_or_game": "Syphon Filter: Dark Mirror; Resistance: Retribution",
  "emulator_version": "UNKNOWN",
  "finding": "The graphics packet has headings for official rendering patches under Syphon Filter Dark Mirror and Resistance Retribution, and separately lists ApplyDepthReadback() under 'Official Depth Readback Usage'. It does not associate that function with either title or document any function's effect.",
  "evidence_references": [
    "Local packet: research/sources/psphd_ps4devwiki_graphics_textures.md; existing source attribution S4 (source URL: https://www.psdevwiki.com/ps4/index.php?title=PSP_Classics_Configuration_Files_(Official)&oldid=295120)"
  ],
  "confidence": "MEDIUM",
  "related_findings": ["PSPHD-00008"],
  "tests": [],
  "notes": ["The packet does not list AdjustUVJitter(), AddGPUHook(), or VideoScale(), and does not map ApplyDepthReadback() to a title. The packet itself contains no URL; the S4 attribution is retained from existing source references."]
}
