{
  "id": "PSPHD-00001",
  "status": "UNKNOWN",
  "target": "PSPHD references in PS4 Developer Wiki source set",
  "subsystem": "versioning",
  "title_or_game": "UNKNOWN",
  "emulator_version": "UNKNOWN",
  "finding": "The supplied core packet contains no emulator version or build identifier. Whether PSPHD versions or build numbers are documented elsewhere is UNKNOWN.",
  "evidence_references": [
    "Local packet: research/sources/psphd_ps4devwiki_core.md; existing source attribution S1 (source URL: https://www.psdevwiki.com/ps4/index.php?title=PSP_Emulation&oldid=297238)",
    "Local packet: research/sources/psphd_ps4devwiki_core.md; existing source attribution S4 (source URL: https://www.psdevwiki.com/ps4/index.php?title=PSP_Classics_Configuration_Files_(Official)&oldid=295120)"
  ],
  "confidence": "UNKNOWN",
  "related_findings": ["PSPHD-00011", "PSPHD-00012"],
  "tests": [],
  "notes": ["The packet itself contains no source URL or version/build identifier. Source URL mappings are retained from the existing research references; source pages were not independently fetched. Do not infer version/build identifiers from titles or platforms."]
}
